our_competitors,Date_Posted,Media_Type,Post_Caption,Likes_Counts,Comments_Counts,Shared_Counts,total_followers
GetSmarter,2022-02-25 18:35:36.579528,Image,"Does your current career plan address challenges such as accelerated digitization, changing priorities, or burnout? Gain an approach to professional development that considers well-being as well as your paycheck: https://bit.ly/3HQywXs",19,0,0,"234,404"
GetSmarter,2022-04-25 12:35:36.579528,Image,The time for change is now. Enhance your business’s growth strategy by effectively implementing AI initiatives. Learn how in this new program from IE University. https://bit.ly/3vyy6Qt,5,0,0,"234,404"
GetSmarter,2022-04-21 18:35:36.579528,Image,Why are some nations wealthy while others remain poor? Explore the multidisciplinary factors behind inequality and develop the tools to promote higher living standards for all on the new course from LSE Online. https://bit.ly/3vyRg8H,5,0,0,"234,404"
GetSmarter,2022-04-22 18:35:36.579528,Image,How are fintech innovations impacting your context? Find out and explore appropriate responses over just five weeks in this new program from IMD Business School. https://bit.ly/3OrCOs4,5,1,0,"234,404"
GetSmarter,2022-04-21 18:35:36.579528,Image,"As a speaker, coach, and course creator, Simone Heng says that her life changed when she started investing in education as an adult. “I noticed an increase in my confidence, mindset, and eventually my income as well,” she says.#GetSmarterOnline #LifelongLearner #LearnOnline #DreamCareer",4,0,0,"234,404"
GetSmarter,2022-04-19 18:35:36.579528,"Other: Poll, Shared Post, etc","Sue Dopson, Programme Director on the Executive Education at Saïd Business School Women’s Leadership Development Programme, shares her insight on managing difficult conversations at work. Learn more here: https://bit.ly/3CtkF7l",5,0,0,"234,404"
GetSmarter,2022-04-20 18:35:36.579528,Youtube Video,"Digital transformation, leadership, strategy, or finance. Whatever you need to learn, benefit from the world-class education at Saïd Business School, University of Oxford, online: https://bit.ly/3ratUFE",4,0,0,"234,404"
GetSmarter,2022-04-18 18:35:36.579528,Image,"After completing a course with GetSmarter, CCO Anna Frankowska reflects on life as a learning journey, especially in today’s changing world. “Luckily, we can access the very best quality education remotely from anywhere, at any time, allowing us to educate ourselves, and become better leaders and change-makers,” she says.Develop your professional skills and drive digital innovation with an online course from GetSmarter. Find your next course here: https://bit.ly/3JIK7bo.#GetSmarterOnline #LifelongLearner #LearnOnline #DreamCareer",3,0,0,"234,404"
GetSmarter,2022-04-22 18:35:36.579528,"Other: Poll, Shared Post, etc","Gillian Charlesworth, a Guest Expert on the Oxford Executive Leadership Programme from Executive Education at Saïd Business School, discusses adapting your leadership style to suit different contexts. Learn more here: https://bit.ly/3sVhgLx",5,0,0,"234,404"
GetSmarter,2022-04-11 18:35:36.579528,Image,"As the climate changes and populations expand, our methods of producing and processing food must urgently adapt. Learn how applying new business models and transforming supply chains can help build a more resilient global food system with the Cambridge Institute for Sustainability Leadership (CISL). https://bit.ly/3JhggX3",0,0,0,"234,404"
GetSmarter,2022-04-11 18:35:36.579528,Image,"An award-winning coach, corporate trainer, business consultant, and owner of Pinq Inc, a business hub for women, Brittany Garth was looking to upskill in a way that suits her schedule. Experience a world-leading university and an online education that sets you apart. Explore which GetSmarter courses are starting soon: https://bit.ly/3paPKHK#GetSmarterOnline #LifelongLearner #LearnOnline #DreamCareer",3,0,0,"234,404"
GetSmarter,2022-04-04 18:35:36.579528,Image,"Imagine a world in which house sellers, buyers, and mortgage lenders have access to a public list of all properties on the housing market, alongside independent and public valuations for each listing. With AI, this could be possible.Explore the megatrends and disruptions impacting real estate in the Executive Education at Saïd Business School Future of Real Estate Investment Programme: https://bit.ly/3izxPa2",2,0,0,"234,404"
GetSmarter,2022-04-04 18:35:36.579528,Image,Ready to operate at your full potential? Unlock the power of a high-performance mindset in this new micro course from Stanford Center for Health Education. https://bit.ly/36QZqB0,3,0,0,"234,404"
GetSmarter,2022-04-18 18:35:36.579528,Article,"Are you ready to upskill yourself in private markets? Join Ludovic Phalippou, Programme Director on the Saïd Business School, University of Oxford Private Markets Investments Programme, as he discusses private equity in a series of business-related podcasts.Listen here: https://bit.ly/3KEVQJy",6,2,2 ,"234,404"
GetSmarter,2022-04-11 18:35:36.579528,"Other: Poll, Shared Post, etc","Phil Smith, Guest Expert on the Oxford Executive Leadership Programme from Executive Education at Saïd Business School, talks about leading with vision. Learn more here: https://bit.ly/362O0JM",3,0,0,"234,404"
GetSmarter,2022-04-04 18:35:36.579528,"Other: Poll, Shared Post, etc","Marya Besharov, Guest Expert on the Executive Education at Saïd Business School Leading Sustainable Corporations Programme, discusses how to harness the “both/and” mindset in business. Learn more here: https://bit.ly/3tJrb5X",0,0,0,"234,404"
GetSmarter,2022-04-04 18:35:36.579528,Image,Crises often come without warning. Ensure your healthcare organization is properly prepared at all times. Join this new course from the Stanford Center for Health Education. https://bit.ly/3iO8w3Q,3,0,0,"234,404"
GetSmarter,2022-02-25 18:35:36.579528,Multiple Images,"We're proud of the caliber of our Guest Experts and the passion they have for their subject matter. Brigitte Mentz will be sharing her extensive knowledge on the University of Cape Town Operations Management online short course, starting March 7, 2022: https://bit.ly/3I24IHt",4,0,0,"234,404"
GetSmarter,2022-03-25 18:35:36.579528,Image,Move beyond the initial hype of FinTech innovation with this course from Harvard Online. https://bit.ly/3L3bZb8,2,0,0,"234,404"
GetSmarter,2022-03-25 18:35:36.579528,"Other: Poll, Shared Post, etc","Andrew White, Guest Expert on the Executive Education at Saïd Business School Leadership Programme, discusses the importance of leadership with purpose. Read more here: https://bit.ly/3HZGDA2",2,0,0,"234,404"
GetSmarter,2022-03-25 18:35:36.579528,Image,Are you a strategic decision maker? Gain the tools to adapt in the face of digital disruption with MIT Sloan School of Management. https://bit.ly/3tkDSW5,0,0,0,"234,404"
GetSmarter,2022-03-25 18:35:36.579528,Image,"Develop an in-depth understanding of real estate economics and markets, guided by renowned LSE Online faculty and industry experts. https://bit.ly/36atfwp",3,1,0,"234,404"
GetSmarter,2022-03-25 18:35:36.579528,Image,Enhance your management and leadership competencies with the 10-week LSE Online MBA Essentials online certificate course. https://bit.ly/37J9yff,7,0,0,"234,404"
GetSmarter,2022-03-25 18:35:36.579528,Image,Learn to analyze technologies revolutionizing the financial services industry through world-class content from Harvard University VPAL and HarvardX. https://bit.ly/3KQiXA8,1,0,0,"234,404"
GetSmarter,2022-03-25 18:35:36.579528,Image,How do you capitalize on consumer engagement? Develop the skills to analyze interactions across all digital channels with MIT Sloan School of Management. https://bit.ly/362V9KH,0,0,0,"234,404"
GetSmarter,2022-04-11 18:35:36.579528,Article,"In the face of the climate crisis, megaprojects need to have modularity in design and speed in delivery if they are to succeed. Bent Flyvbjerg from Saïd Business School, University of Oxford shares how to slash megaprojects' cost while boosting delivery speed. Read it here: https://bit.ly/3KCOuX2Go beyond traditional project management and redefine project success with a strategic approach on the Saïd Business School, University of Oxford Leading Strategic Projects Programme. Sign up today:  https://bit.ly/3Ar3v9y",1,0,0,"234,404"
GetSmarter,2022-03-25 18:35:36.579528,"Other: Poll, Shared Post, etc","Sue Dopson, Programme Director on the Executive Education at Saïd Business School Women’s Leadership Development Programme, discusses ways to adopt contemporary leadership in your organisation. Learn more here: https://bit.ly/3IWy7TH",8,0,0,"234,404"
GetSmarter,2022-04-11 18:35:36.579528,Article,"At a time when sustainability has never been more crucial, Rachel Delhaise re-examined how she could make a bigger impact in her career. In celebration of inspiring women this Women’s History Month, watch as she shares her learning journey. https://bit.ly/3D3hQKR#GetSmarterOnline #LifelongLearner #GetSmarter #LearnOnline #CelebratingWomen",3,0,0,"234,404"
GetSmarter,2022-03-25 18:35:36.579528,Image,"Is your leadership style adding value to your organisation? Gain a deeper understanding of your role and purpose, and maximise your influence as a leader on the Executive Education at Saïd Business School Executive Leadership Programme. https://bit.ly/3Jpabss",3,0,0,"234,404"
GetSmarter,2022-03-25 18:35:36.579528,"Other: Poll, Shared Post, etc","International Women's Day, on Tuesday, 8 March, follows the theme #BreakTheBias, encouraging you to celebrate women’s achievements, raise awareness against bias, and take action for equality. In celebration, Executive Education at Saïd Business School is offering 10% off when you register for the Oxford Women’s Leadership Development Programme between 7 and 14 March 2022 using the code OXFWMLIWD2022. Enhance your leadership strengths and learn how to drive inclusion in business. Find out more: https://bit.ly/3tjIbzO",13,0,0,"234,404"
GetSmarter,2022-03-25 18:35:36.579528,Image,"Gain an essential understanding of the current global economic, social, and environmental pressures affecting your business with Cambridge Institute for Sustainability Leadership (CISL). https://bit.ly/36FmlPz",3,0,0,"234,404"
GetSmarter,2022-04-04 18:35:36.579528,Article,"The European Young Leader programme aims to promote a European identity by engaging some of its most promising talents in initiatives that will shape the continent’s future. Former Executive Education at Saïd Business School Executive Leadership Programme participant, Paolo Petrocelli, has been named as a European Young Leader, Class of 2022.Read more: https://bit.ly/3wO8Ckg",2,0,0,"234,404"
GetSmarter,2022-03-25 18:35:36.579528,Article,"According to Professor Michael Smets, Programme Director on the Oxford Leading Professional Services Firms and Guest Expert on the Saïd Business School, University of Oxford Executive Leadership Programme, ""The power of doubt has gained traction."" Explore why self-doubters earn our trust in this article: https://bit.ly/3KNB0rw",2,0,0,"234,404"
GetSmarter,2022-03-25 18:35:36.579528,Image,"SDA Bocconi School of Management is one of the few elite business schools to have garnered the ‘triple crown’ of the world’s most prestigious international accreditations (AMBA, AACSB, and EQUIS). Experience world-leading online education when you join the Bitcoin and Blockchain Program: https://bit.ly/3wgqOD7",3,0,0,"234,404"
GetSmarter,2022-02-25 18:35:36.579528,"Other: Poll, Shared Post, etc","We've partnered with Capitec Bank to help you build your skills and strengthen your career.Simply add the GetSmarter widget in the Capitec app. Browse online short courses from top universities and institutions, and receive a Live Better discount on your selected GetSmarter course. Learn more here: https://bit.ly/3sTC6tE",41,0,0,"234,404"
GetSmarter,2022-03-25 18:35:36.579528,Image,Drive workforce innovation for a changing economy. Explore the potential of AI in business with MIT Sloan School of Management and MIT Computer Science and Artificial Intelligence Laboratory (CSAIL). https://bit.ly/3KV0JgG,3,0,0,"234,404"
GetSmarter,2022-03-25 18:35:36.579528,Image,"Are you equipped to lead effective, responsible, and beneficial AI innovation in your organization? Gain the skills and frameworks with this new program from MIT Sloan School of Management and MIT Schwarzman College of Computing. https://bit.ly/3I8ZyIU",7,0,0,"234,404"
GetSmarter,2022-03-25 18:35:36.579528,Image,Join the Cybersecurity for Managers online program from the Institute for Management Development (IMD) today: https://bit.ly/35WYrz4 Experience premium online learning with a business school ranked #1 worldwide for open programs nine years in a row by the Financial Times. https://bit.ly/36m14KC,3,0,0,"234,404"
GetSmarter,2022-03-25 18:35:36.579528,Image,Harness blockchain technology to unlock economic opportunities with this online program from the MIT Sloan School of Management. https://bit.ly/3JjKFoy,2,0,0,"234,404"
GetSmarter,2021-09-25 18:35:36.579528,"Other: Poll, Shared Post, etc",How do we prioritise staff development in a time-strapped world? Follow these guiding principles on how to put upskilling into action. https://bit.ly/3wnAKa5,0,0,0,"234,404"
GetSmarter,2022-03-25 18:35:36.579528,Image,Job satisfaction is multidimensional. Learn how to nurture and develop them all to create a career that changes as you do. Find out more: https://bit.ly/3HQywXs,3,0,0,"234,404"
GetSmarter,2022-03-25 18:35:36.579528,Image,Join the Leading Digital Innovation in Supply Chain and Logistics online program from the Institute for Management Development (IMD) today: https://bit.ly/3tf300l Experience premium online learning with a business school ranked #1 worldwide for open programs nine years in a row by the Financial Times. https://bit.ly/36m14KC,6,0,0,"234,404"
GetSmarter,2022-03-25 18:35:36.579528,Article,"Is space the new digital? In this article by Marc Ventresca, associate professor of strategic management at Saïd Business School, University of Oxford and Programme Director on the Oxford Strategic Innovation Programme, he investigates the probability – and possibility – of investing in space.Read it here: https://bit.ly/3fRINGq",1,0,0,"234,404"
GetSmarter,2022-03-25 18:35:36.579528,Article,"In a time of digital transformation and service disruption, the most effective leaders are female. Here are the four reasons why your workplace needs more women in leadership. https://bit.ly/3CsgiK2",5,1,1 ,"234,404"
GetSmarter,2022-03-25 18:35:36.579528,Image,Learn how to evaluate business opportunities and secure investor support for your start-up idea on this new course from the LSE Online. https://bit.ly/3puL6oe,3,0,0,"234,404"
GetSmarter,2021-11-25 18:35:36.579528,"Other: Poll, Shared Post, etc",Learn about transforming traditional business structures with MIT Sloan School of Management. Watch the video to gain expert insights. https://bit.ly/3aIAV7D#GetSmarterOnline,2,0,0,"234,404"
GetSmarter,2022-03-25 18:35:36.579528,Image,"Whether or not you quit your job, being prepared for a career pivot is critical to long-term success. Unpack the skills and capabilities you’ll need to thrive in any industry or occupation. Read our latest blog for more: https://bit.ly/3HQywXs",1,0,0,"234,404"
GetSmarter,2021-11-25 18:35:36.579528,"Other: Poll, Shared Post, etc",Discover the benefits of using the crowd to tackle problems. Watch the video to gain expert insights from MIT Sloan School of Management. https://bit.ly/3vgWFRf #GetSmarterOnline,1,0,0,"234,404"
GetSmarter,2021-11-25 18:35:36.579528,"Other: Poll, Shared Post, etc",Are your emotions impacting your teams? Learn to set the tone with Rodrigo Canales from Yale SOM Executive Education and #GetSmarterOnline. Watch the full video here: https://bit.ly/3aKlcEQ,5,0,0,"234,404"
GetSmarter,2021-10-25 18:35:36.579528,Multiple Images,"Join Bruce Whitfield, today, for a lunchtime webinar on how to become a powerful and engaging public speaker: https://buff.ly/3BwG3Xv.  As a South African media icon, Bruce Whitfield has collaborated with GetSmarter on a new and exclusive GetSmarter online micro course. Find out more here: https://bit.ly/3vehJYH",3,0,0,"234,404"
GetSmarter,2021-11-25 18:35:36.579528,"Other: Poll, Shared Post, etc","Hear how Toyota transformed their approach to innovation, with MIT Sloan School of Management. Watch the video to gain expert insights. https://bit.ly/3aD39QX#GetSmarterOnline",4,0,0,"234,404"
GetSmarter,2021-11-25 18:35:36.579528,"Other: Poll, Shared Post, etc",Become a better leader by getting to know your strengths. Find out how with Emma Seppälä from Yale SOM Executive Education and #GetSmarterOnline. Watch the full video here: https://bit.ly/3vgurpZ,3,0,0,"234,404"
GetSmarter,2022-03-25 18:35:36.579528,Article,"As we face a progressively more complex future, leaders are increasingly in need of information based on facts and empirical evidence. Research has never been more crucial. Professor Andrew Stephen, associate dean of research at Saïd Business School, University of Oxford, talks about why business leaders need science-based research to understand complexities and make best-informed decisions for the future. Read it here: https://bit.ly/3KBRWAW",0,0,0,"234,404"
GetSmarter,2022-03-25 18:35:36.579528,Article,"Rhonda Hadi, associate professor of marketing at Saïd Business School, University of Oxford says the next 25 years will see the rise of sensory marketing. Read the article here: https://bit.ly/3nT9FKrLearn how to develop an integrated marketing strategy making use of sensory marketing on the Oxford Digital Marketing: Disruptive Strategy Programme. Sign up today: https://bit.ly/35msL5z",2,0,0,"234,404"
GetSmarter,2021-10-25 18:35:36.579528,"Other: Poll, Shared Post, etc","Tom Cort, sustainability lecturer at Yale SOM Executive Education explains why you need to know your stakeholders. Gain expert insights with #GetSmarterOnline. Watch the full video here: https://bit.ly/3aFwyKE",0,0,0,"234,404"
GetSmarter,2022-03-25 18:35:36.579528,Article,"Research shows that women take a more transformative, holistic approach to leadership. Explore the four biggest ways your company can benefit from investing in its female leaders: https://bit.ly/3CsgiK2#GetSmarterOnline #LifelongLearner #GetSmarter #LearnOnline #CelebratingWomen",6,1,2 ,"234,404"
GetSmarter,2022-03-25 18:35:36.579528,Article,"Every 50–60 years, the world of business undergoes an epoch-changing transformation. Read on as Colin Mayer, Guest Expert on the Saïd Business School, University of Oxford Leading Sustainable Corporations Programme explains how this current era is set to reconfigure corporations for decades to come.Read the article here: https://bit.ly/3qTPCgX",3,0,0,"234,404"
GetSmarter,2021-10-25 18:35:36.579528,"Other: Poll, Shared Post, etc","Discover the benefit of starting with problems vs. solutions, with Faculty Directors from MIT Sloan School of Management. Watch the video to gain expert insights. https://bit.ly/3n1H4lc#GetSmarterOnline",1 comment,1,0,"234,404"
GetSmarter,2022-03-25 18:35:36.579528,Article,"Business leaders need to go beyond greenwashing to effect meaningful, positive change. But how? Explore five business activism practices that can help you take real action today in this article written by Programme Director Charmian Love and Guest Expert Robert Eccles from the Executive Education at Saïd Business School Climate Emergency Programme: https://bit.ly/3vhC4OS",1,0,0,"234,404"
GetSmarter,2022-02-25 18:35:36.579528,Image,Create a change management plan that takes your organization forward with this new University of Toronto - Rotman School of Management program. https://bit.ly/3Ikmu8M,3,0,0,"234,404"
GetSmarter,2021-10-25 18:35:36.579528,"Other: Poll, Shared Post, etc",How does ethics affect your decision making? Discover values-based leadership with Yale SOM Executive Education and #GetSmarterOnline. Watch the full video here: https://bit.ly/3vd5oUL,2,0,0,"234,404"
GetSmarter,2021-10-25 18:35:36.579528,"Other: Poll, Shared Post, etc",Find out why the structure of your social network counts for more than its size. Gain expert insights from Yale SOM Executive Education and #GetSmarterOnline. Watch the full video here: https://bit.ly/3j3ysZQ,3,0,0,"234,404"
GetSmarter,2021-10-25 18:35:36.579528,"Other: Poll, Shared Post, etc",Understand the exponential increase in technology with Faculty Directors from MIT Sloan School of Management. Watch the video to gain expert insights. https://bit.ly/30jGLdw #GetSmarterOnline,3,0,0,"234,404"
GetSmarter,2021-10-25 18:35:36.579528,"Other: Poll, Shared Post, etc",Unpack MIT’s definition of innovation with the faculty directors from MIT Sloan School of Management. Watch the video to gain expert insights. https://bit.ly/3iYfnsg #GetSmarterOnline,2,0,0,"234,404"
GetSmarter,2021-10-25 18:35:36.579528,"Other: Poll, Shared Post, etc",Big problems need strong leaders. Learn how to bring innovation to every table with Yale SOM Executive Education and #GetSmarterOnline. Watch the full video here: https://bit.ly/3BG2TMZ,2,0,0,"234,404"
GetSmarter,2021-09-25 18:35:36.579528,"Other: Poll, Shared Post, etc",Take a deeper look at complex diversity with University of Cape Town’s Ameeta Jaga. Watch the full video here: https://bit.ly/3uDtO9t #GetSmarterOnline,3,0,0,"234,404"
GetSmarter,2022-02-25 18:35:36.579528,Youtube Video,"How do businesses need to adapt? Saïd Business School, University of Oxford looks 25 years into the future in their new Oxford Answers #ThoughtLeadership series to answer this question. Join them as they explore systemic change in finance, global strategy, and organisational behaviour: https://bit.ly/3re8fw9",3,0,0,"234,404"
GetSmarter,2021-09-25 18:35:36.579528,"Other: Poll, Shared Post, etc",Learn more about creating safe organizational spaces with Rice Business - Jones Graduate School of Business's Dr. Mikki Hebl. Watch the full video here: https://bit.ly/3i6LMfJ #GetSmarterOnline,3,0,0,"234,404"
GetSmarter,2021-09-25 18:35:36.579528,"Other: Poll, Shared Post, etc","Explore diversity as a corporate social responsibility with Northwestern University Professor Alvin B. Tillery, Jr. Watch the full video here: https://bit.ly/3D4TyyT #GetSmarterOnline",0,0,0,"234,404"
GetSmarter,2022-02-25 18:35:36.579528,Image,"As a major contributor to the world's pollution, what must the fashion industry do to change?Antónia Mussache, a past participant in the SDA Bocconi Sustainable Fashion Branding Program shares her insights on addressing waste culture: https://bit.ly/3gTwvO6",3,0,0,"234,404"
GetSmarter,2021-09-25 18:35:36.579528,"Other: Poll, Shared Post, etc",Consider the social and business cases for workplace diversity with Dr. Mike Szymanski from EGADE Business School del Tecnológico de Monterrey. Watch the full video here: https://bit.ly/3EInIcB#GetSmarterOnline,1,0,0,"234,404"
GetSmarter,2022-02-25 18:35:36.579528,Article,"Congratulations to Saïd Business School, University of Oxford on its 25th anniversary. We're proud to partner with this prestigious institution, having welcomed 25,000 participants to their online programmes.Are you ready to join the international Saïd Business School, University of Oxford online community? Get 20% off your next programme: https://bit.ly/3tXTkbl",6,0,0,"234,404"
GetSmarter,2022-02-25 18:35:36.579528,Article,"Learn as you lead with Sally Maitlis, professor of organisational behaviour and leadership at Saïd Business School, University of Oxford and John Flint, former CEO of HSBC, and now the first CEO of the UK Infrastructure Bank.Drawing on John’s extensive leadership experience, this conversation focuses on a critical but often underappreciated quality of leaders – the capacity to learn from challenges.Join the conversation: https://bit.ly/3rL6Zjm",7,0,0,"234,404"
GetSmarter,2022-03-25 18:35:36.579528,Article,Is sustainability embedded in your business strategy? The Independent shares the courses you need to drive change in your organization. Read the article here: https://bit.ly/3u2o2hL,3,0,0,"234,404"
GetSmarter,2021-09-25 18:35:36.579528,"Other: Poll, Shared Post, etc","Find out why social proof matters in social media advertising with Sinan Aral, Faculty Director in the Social Media Strategy online short course from MIT Sloan School of Management. Watch the video. https://bit.ly/3yQgxLi #GetSmarterOnline",4,0,0,"234,404"
GetSmarter,2021-09-25 18:35:36.579528,"Other: Poll, Shared Post, etc","Discover new ways to understand the algorithms behind social media communications with Ben Shields, Faculty Director in the Interpersonal Communication online short course from MIT Sloan School of Management. Watch the full video here: https://bit.ly/3jPXtbZ #GetSmarterOnline",2,0,0,"234,404"
GetSmarter,2021-10-25 18:35:36.579528,"Other: Poll, Shared Post, etc",Learn how to become a diversity ally with Rice Business - Jones Graduate School of Business’s Dr. Eden King. Watch the full video here: https://bit.ly/2Ymitz2 #GetSmarterOnline,2,0,0,"234,404"
GetSmarter,2022-02-25 18:35:36.579528,Article,"Saïd Business School, University of Oxford's online programmes with GetSmarter have now helped to change the lives of over 25,000 people. Join this growing global network today: https://bit.ly/3G8rgo8",5,0,0,"234,404"
GetSmarter,2021-09-25 18:35:36.579528,"Other: Poll, Shared Post, etc","Discover the power of utilizing a crowdsourcing strategy with Andrew McAfee, Faculty Director in the Digital Business Strategy online short course from MIT Sloan School of Management. Watch the full video here: https://bit.ly/3yQ57au#GetSmarterOnline",2,0,0,"234,404"
